{
  "schema_name": "lifecycle-state",
  "schema_version": "1.0",
  "generated_by": "ACDLC-v1.6",
  "framework": "ACDLC",
  "version": "1.6",
  "task_id": "SIM-004",
  "active_stage": "Stage 0: GPS Foundation",
  "status": "RUNNING",
  "context_bundle": {
    "version": "1.0.0",
    "path": "templates/context-bundle-template.md",
    "compressed": false
  },
  "metrics": {
    "token_limit": 250000,
    "tokens_consumed": 0,
    "cost_consumed_usd": 0.0,
    "execution_retries": 0
  },
  "remediation": {
    "escalated_to_human": true,
    "retry_limit_hit": true
  }
}